{
  "slug": "epicstech-10f",
  "nameZh": "史詩科技",
  "nameEn": "",
  "category": "office",
  "year": 2025,
  "heroImage": "assets/images/projects/epicstech-10f/render-01.jpg",
  "categoryLabel": "Corporate Office",
  "locationZh": "台北南港",
  "yearLabel": "2025",
  "designBuildLabel": "HQ Interior",
  "descriptionZh": "史詩科技 10 樓辦公空間翻新專案，以精準的空間配置與品牌色系整合，打造高效能現代辦公環境，施工期間維持正常營運。",
  "scopeZh": "企業辦公室",
  "specs": [
    {
      "labelZh": "客戶",
      "value": "史詩科技 Epicstech"
    },
    {
      "labelZh": "類型",
      "value": "企業辦公室"
    },
    {
      "labelZh": "坪數",
      "value": "50 坪"
    },
    {
      "labelZh": "地點",
      "value": "台北南港"
    },
    {
      "labelZh": "完工年份",
      "value": "2025"
    }
  ],
  "gallery": [
    {
      "image": "assets/images/projects/epicstech-10f/floorplan.jpg",
      "alt": "平面配置圖"
    },
    {
      "image": "assets/images/projects/epicstech-10f/render-01.jpg",
      "alt": "空間效果圖 01"
    },
    {
      "image": "assets/images/projects/epicstech-10f/render-02.jpg",
      "alt": "空間效果圖 02"
    },
    {
      "image": "assets/images/projects/epicstech-10f/render-03.jpg",
      "alt": "空間效果圖 03"
    },
    {
      "image": "assets/images/projects/epicstech-10f/render-04.jpg",
      "alt": "空間效果圖 04"
    },
    {
      "image": "assets/images/projects/epicstech-10f/render-05.jpg",
      "alt": "空間效果圖 05"
    },
    {
      "image": "assets/images/projects/epicstech-10f/render-06.jpg",
      "alt": "空間效果圖 06"
    }
  ]
}
