{
  "slug": "xinlan",
  "nameZh": "欣蘭企業",
  "nameEn": "",
  "category": "office",
  "year": 2025,
  "heroImage": "assets/images/projects/xinlan/render-01.jpg",
  "categoryLabel": "Corporate Office",
  "locationZh": "台北南港",
  "yearLabel": "2025",
  "designBuildLabel": "HQ Interior",
  "descriptionZh": "欣蘭企業 9 樓辦公空間設計施工，依據客戶的業務特性與團隊動線需求，規劃兼具專業感與使用效率的現代辦公環境。",
  "scopeZh": "企業辦公室",
  "specs": [
    {
      "labelZh": "客戶",
      "value": "欣蘭企業"
    },
    {
      "labelZh": "類型",
      "value": "企業辦公室"
    },
    {
      "labelZh": "坪數",
      "value": "106 坪"
    },
    {
      "labelZh": "地點",
      "value": "台北南港"
    },
    {
      "labelZh": "完工年份",
      "value": "2025"
    }
  ],
  "gallery": [
    {
      "image": "assets/images/projects/xinlan/floorplan.jpg",
      "alt": "平面配置圖"
    },
    {
      "image": "assets/images/projects/xinlan/render-01.jpg",
      "alt": "空間效果圖 01"
    },
    {
      "image": "assets/images/projects/xinlan/render-02.jpg",
      "alt": "空間效果圖 02"
    },
    {
      "image": "assets/images/projects/xinlan/render-03.jpg",
      "alt": "空間效果圖 03"
    },
    {
      "image": "assets/images/projects/xinlan/render-04.jpg",
      "alt": "空間效果圖 04"
    },
    {
      "image": "assets/images/projects/xinlan/render-05.jpg",
      "alt": "空間效果圖 05"
    },
    {
      "image": "assets/images/projects/xinlan/render-06.jpg",
      "alt": "空間效果圖 06"
    },
    {
      "image": "assets/images/projects/xinlan/render-07.jpg",
      "alt": "空間效果圖 07"
    },
    {
      "image": "assets/images/projects/xinlan/render-08.jpg",
      "alt": "空間效果圖 08"
    }
  ]
}
