{
  "slug": "zhongbao-baojing",
  "nameZh": "中保保經",
  "nameEn": "",
  "category": "office",
  "year": 2025,
  "heroImage": "assets/images/projects/zhongbao-baojing/render-04.jpg",
  "categoryLabel": "Corporate Office",
  "locationZh": "台北南港",
  "yearLabel": "2025",
  "designBuildLabel": "HQ Interior",
  "descriptionZh": "中保科技旗下中保保經 11 樓辦公空間設計施工，延續中保集團一貫的穩重專業形象，以精準工法打造符合金融保險產業定位的辦公環境。",
  "scopeZh": "企業辦公室",
  "specs": [
    {
      "labelZh": "客戶",
      "value": "中保科技（中保保經）"
    },
    {
      "labelZh": "類型",
      "value": "企業辦公室"
    },
    {
      "labelZh": "坪數",
      "value": "60 坪"
    },
    {
      "labelZh": "地點",
      "value": "台北南港"
    },
    {
      "labelZh": "完工年份",
      "value": "2025"
    }
  ],
  "gallery": [
    {
      "image": "assets/images/projects/zhongbao-baojing/render-02.jpg",
      "alt": "平面配置圖"
    },
    {
      "image": "assets/images/projects/zhongbao-baojing/render-03.jpg",
      "alt": "空間效果圖 03"
    },
    {
      "image": "assets/images/projects/zhongbao-baojing/render-04.jpg",
      "alt": "空間效果圖 04"
    },
    {
      "image": "assets/images/projects/zhongbao-baojing/render-05.jpg",
      "alt": "空間效果圖 05"
    },
    {
      "image": "assets/images/projects/zhongbao-baojing/render-06.jpg",
      "alt": "空間效果圖 06"
    },
    {
      "image": "assets/images/projects/zhongbao-baojing/render-07.jpg",
      "alt": "空間效果圖 07"
    },
    {
      "image": "assets/images/projects/zhongbao-baojing/render-08.jpg",
      "alt": "空間效果圖 08"
    },
    {
      "image": "assets/images/projects/zhongbao-baojing/render-09.jpg",
      "alt": "空間效果圖 09"
    },
    {
      "image": "assets/images/projects/zhongbao-baojing/render-10.jpg",
      "alt": "空間效果圖 10"
    },
    {
      "image": "assets/images/projects/zhongbao-baojing/render-11.jpg",
      "alt": "空間效果圖 11"
    },
    {
      "image": "assets/images/projects/zhongbao-baojing/render-12.jpg",
      "alt": "空間效果圖 12"
    },
    {
      "image": "assets/images/projects/zhongbao-baojing/render-13.jpg",
      "alt": "空間效果圖 13"
    }
  ],
  "client": "中保保經"
}
