{
  "slug": "ledaojia",
  "nameZh": "樂到家國際娛樂",
  "nameEn": "",
  "category": "office",
  "year": 2025,
  "heroImage": "assets/images/projects/ledaojia/render-04.jpg",
  "categoryLabel": "Corporate Office",
  "locationZh": "台北南港",
  "yearLabel": "2025",
  "designBuildLabel": "HQ Interior",
  "descriptionZh": "樂到家國際娛樂 9 樓辦公空間設計施工，以娛樂產業的活潑創意為調性，在專業辦公格局中注入品牌個性與空間活力。",
  "scopeZh": "企業辦公室",
  "specs": [
    {
      "labelZh": "客戶",
      "value": "樂到家國際娛樂"
    },
    {
      "labelZh": "類型",
      "value": "企業辦公室"
    },
    {
      "labelZh": "坪數",
      "value": "15 坪"
    },
    {
      "labelZh": "地點",
      "value": "台北南港"
    },
    {
      "labelZh": "完工年份",
      "value": "2025"
    }
  ],
  "gallery": [
    {
      "image": "assets/images/projects/ledaojia/render-02.jpg",
      "alt": "平面配置圖"
    },
    {
      "image": "assets/images/projects/ledaojia/render-03.jpg",
      "alt": "空間效果圖 03"
    },
    {
      "image": "assets/images/projects/ledaojia/render-04.jpg",
      "alt": "空間效果圖 04"
    },
    {
      "image": "assets/images/projects/ledaojia/render-05.jpg",
      "alt": "空間效果圖 05"
    },
    {
      "image": "assets/images/projects/ledaojia/render-06.jpg",
      "alt": "空間效果圖 06"
    },
    {
      "image": "assets/images/projects/ledaojia/render-07.jpg",
      "alt": "空間效果圖 07"
    },
    {
      "image": "assets/images/projects/ledaojia/render-08.jpg",
      "alt": "空間效果圖 08"
    }
  ],
  "client": "樂到家娛樂"
}
